{
  "$schema": "https://json-schema.org/draft/2020-12/schema",
  "$id": "https://lattice.dev/schemas/activity.schema.json",
  "title": "ActivityDef",
  "description": "Something an agent can do about its needs: candidacy conditions, a cost formula, the needs it restores on completion, and the task list that realizes it \u2014 the same task vocabulary as schedules and BT leaves. Selector score = \u03A3 (need urgency \u00D7 satisfaction) / cost (ch05 \u00A75.4).",
  "type": "object",
  "properties": {
    "id": {
      "type": "string",
      "description": "Globally unique def ID."
    },
    "type": {
      "const": "activity"
    },
    "description": {
      "type": "string",
      "description": "One line for humans and LLMs (surfaced by the manifest)."
    },
    "inherits": {
      "type": "string",
      "description": "Parent def ID (same kind); objects deep-merge, scalars override, arrays replace or take {\u0022$append\u0022/\u0022$remove\u0022} patches.",
      "x-lattice-ref": "activity"
    },
    "satisfies": {
      "type": "object",
      "additionalProperties": {
        "type": "number"
      },
      "description": "Need def ID \u2192 value restored when the activity completes."
    },
    "cost": {
      "type": "string",
      "description": "Cost formula (relative effort; needs/stats/flags in scope). Floored at 0.05 when scoring."
    },
    "conditions": {
      "type": "array",
      "items": {
        "type": "object",
        "x-lattice-union": "condition",
        "description": "A condition primitive payload; see the manifest for arg signatures.",
        "properties": {
          "type": {
            "type": "string",
            "enum": [
              "AgentCondition",
              "AgentMeta",
              "All",
              "Any",
              "BeliefEquals",
              "FlagEquals",
              "FormulaTrue",
              "HasItem",
              "HasTag",
              "NeedBelow",
              "Not",
              "StatAtLeast",
              "UtilityAtLeast"
            ]
          }
        },
        "required": [
          "type"
        ]
      },
      "description": "Condition primitives gating candidacy (subject = the agent)."
    },
    "tasks": {
      "type": "array",
      "items": {
        "type": "object",
        "x-lattice-union": "task",
        "description": "A task primitive payload; see the manifest for arg signatures.",
        "properties": {
          "task": {
            "type": "string",
            "enum": [
              "ClearCondition",
              "FaceEntity",
              "MoveTo",
              "NextPatrolPoint",
              "PerformActivity",
              "PlayAnimation",
              "PublishEvent",
              "SelectNewSchedule",
              "SetCondition",
              "UseSmartObject",
              "Wait"
            ]
          }
        },
        "required": [
          "task"
        ]
      },
      "description": "Ordered task payloads executed when this activity is chosen."
    }
  },
  "required": [
    "id",
    "type"
  ]
}